{
  "domain": "community-microspace-governance",
  "version": 2,
  "sample_id": "record-010",
  "actors": [
    {
      "id": "resident",
      "name": "社区居民",
      "roles": ["诉求人", "议事成员", "认领人", "志愿者"]
    },
    {
      "id": "street-office",
      "name": "街道工作人员",
      "roles": ["承办人员", "复核方"]
    },
    {
      "id": "co-builder",
      "name": "联建单位",
      "roles": ["资源联建方"]
    },
    {
      "id": "operator",
      "name": "空间运营伙伴",
      "roles": ["合作商户", "值守方"]
    }
  ],
  "lifecycle_stages": [
    "诉求收集",
    "方案协商",
    "建设验收",
    "运营共治",
    "定期复核"
  ],
  "facts": [
    "闲置空间被改造为早餐、儿童、文化和运动场景（如屋顶门球场）",
    "居民议事会的争议集中在开放时段、早餐点值守安排、商户收益如何反哺公益等运营规则，这些规则比改造前后照片更决定小微空间能否长久使用",
    "共治产品要求居民先提交诉求并参与方案协商，协商结果作为后续运营与复核的对照基准",
    "项目档案可公开查询：场地产权、安全条件、联建资源、施工验收情况和现行规则",
    "投入运营后，场地预约、志愿排班、设施报修与公益回馈在同一项目下持续运转",
    "部分项目通过场地换服务让合作商户收益反哺公益",
    "居民以认领、值守、报修和议事方式参与长期共治"
  ],
  "operating_matters": [
    "场地预约（如门球场开放时段）",
    "志愿排班（如早餐点值守）",
    "设施报修",
    "公益回馈登记与核对"
  ],
  "change_events": [
    "功能调整",
    "临时关闭",
    "噪声纠纷处置",
    "合作商户退出",
    "认领人变更"
  ],
  "change_rules": [
    "变更生效前必须保存此前约定的版本，不得覆盖",
    "变更必须通知实际受影响者（如预约人、值守志愿者、相邻住户、认领人）"
  ],
  "information_access": [
    "个人诉求内容仅向承办人员开放",
    "诉求处理进度向居民公开可见",
    "项目档案与运营规则向居民公开可查"
  ],
  "review_dimensions": [
    "服务人群",
    "使用情况",
    "维修结果",
    "收益去向"
  ],
  "constraints": [
    "空间项目档案：产权、安全条件、联建资源、施工验收、现行规则均可查",
    "居民协商过程：诉求提交与方案协商全程留痕，协商结果构成项目基准",
    "开放运维管理：预约、志愿排班、报修、公益回馈在同一项目下运转",
    "公益回馈核对：合作商户收益反哺的去向可核对",
    "变更约定留痕：功能调整、临时关闭、噪声纠纷、商户退出、认领人变更时保存旧约定并通知受影响者",
    "诉求隐私边界：个人诉求仅承办人员可见，处理进度对居民公开",
    "协商结果复核：街道按服务人群、使用情况、维修结果、收益去向判断项目是否仍符合最初协商结果"
  ]
}
